{
  "sample": {
    "id": "3f1c2a9e-7b4d-4e2a-9c1f-0a1b2c3d4e5f",
    "code": "S-20261010-001",
    "created_at": "2026-10-10T09:15:00Z",
    "dilution_factor": 10,
    "technician": "tech_01",
    "status": "validated"
  },
  "images": [
    {
      "id": "img_7f3a9c21e4b0",
      "sample_id": "3f1c2a9e-7b4d-4e2a-9c1f-0a1b2c3d4e5f",
      "file_path": null,
      "quality_ok": true,
      "rejection_reason": null,
      "uploaded_at": "2026-10-10T09:16:30Z"
    }
  ],
  "result": {
    "id": "b2e4f6a8-1c3d-4e5f-8a9b-0c1d2e3f4a5b",
    "image_id": "img_7f3a9c21e4b0",
    "total_count": 6,
    "abnormal_count": 1,
    "rectangles_counted": 2,
    "concentration": 3000.0,
    "confidence": 0.9,
    "cells": [
      {
        "x": 158,
        "y": 288,
        "label": "normal",
        "score": 0.94
      },
      {
        "x": 208,
        "y": 308,
        "label": "normal",
        "score": 0.91
      },
      {
        "x": 248,
        "y": 358,
        "label": "normal",
        "score": 0.88
      },
      {
        "x": 311,
        "y": 296,
        "label": "abnormal",
        "score": 0.82
      },
      {
        "x": 338,
        "y": 338,
        "label": "normal",
        "score": 0.97
      },
      {
        "x": 298,
        "y": 368,
        "label": "normal",
        "score": 0.9
      }
    ],
    "model_version": "fake-0.1"
  },
  "validation": {
    "id": "c7d8e9f0-a1b2-4c3d-8e4f-5a6b7c8d9e0f",
    "sample_id": "3f1c2a9e-7b4d-4e2a-9c1f-0a1b2c3d4e5f",
    "corrected_count": 7,
    "corrected_abnormal": 1,
    "validator": "expert_01",
    "comment": "One cell hidden under debris.",
    "validated_at": "2026-10-10T10:02:00Z"
  }
}
